{
  "schema_version": 1,
  "snapshot_version": 1,
  "created_at": "2026-08-23T00:00:00+00:00",
  "source": {
    "name": "Wikidata",
    "dump_uri": "assets/wikidata/wikidata-entities-v1.jsonl",
    "dump_sha256": "c262596d9ddd24a3080dda262f183ad12b62acb81eb107704c44bdf7f788994a",
    "license_id": "CC0-1.0"
  },
  "concepts": [
    {"qid": "Q5", "category": "subject"},
    {"qid": "Q68", "category": "subject"},
    {"qid": "Q140", "category": "subject"},
    {"qid": "Q144", "category": "subject"},
    {"qid": "Q146", "category": "subject"},
    {"qid": "Q152", "category": "subject"},
    {"qid": "Q165", "category": "subject"},
    {"qid": "Q349", "category": "subject"},
    {"qid": "Q376", "category": "subject"},
    {"qid": "Q467", "category": "subject"},
    {"qid": "Q506", "category": "subject"},
    {"qid": "Q527", "category": "subject"},
    {"qid": "Q571", "category": "subject"},
    {"qid": "Q726", "category": "subject"},
    {"qid": "Q830", "category": "subject"},
    {"qid": "Q870", "category": "subject"},
    {"qid": "Q998", "category": "subject"},
    {"qid": "Q1367", "category": "subject"},
    {"qid": "Q1420", "category": "subject"},
    {"qid": "Q2095", "category": "subject"},
    {"qid": "Q2736", "category": "subject"},
    {"qid": "Q2934", "category": "subject"},
    {"qid": "Q3947", "category": "subject"},
    {"qid": "Q4022", "category": "subject"},
    {"qid": "Q4421", "category": "subject"},
    {"qid": "Q5113", "category": "subject"},
    {"qid": "Q5638", "category": "subject"},
    {"qid": "Q6388", "category": "subject"},
    {"qid": "Q7368", "category": "subject"},
    {"qid": "Q7378", "category": "subject"},
    {"qid": "Q7561", "category": "subject"},
    {"qid": "Q7569", "category": "subject"},
    {"qid": "Q7802", "category": "subject"},
    {"qid": "Q7925", "category": "subject"},
    {"qid": "Q8074", "category": "subject"},
    {"qid": "Q81727", "category": "subject"},
    {"qid": "Q8436", "category": "subject"},
    {"qid": "Q8441", "category": "subject"},
    {"qid": "Q8502", "category": "subject"},
    {"qid": "Q8514", "category": "subject"},
    {"qid": "Q9394", "category": "subject"},
    {"qid": "Q9430", "category": "subject"},
    {"qid": "Q9482", "category": "subject"},
    {"qid": "Q10884", "category": "subject"},
    {"qid": "Q11004", "category": "subject"},
    {"qid": "Q11303", "category": "subject"},
    {"qid": "Q11436", "category": "subject"},
    {"qid": "Q11442", "category": "subject"},
    {"qid": "Q11446", "category": "subject"},
    {"qid": "Q11788", "category": "subject"},
    {"qid": "Q12280", "category": "subject"},
    {"qid": "Q13276", "category": "subject"},
    {"qid": "Q15026", "category": "subject"},
    {"qid": "Q15083", "category": "subject"},
    {"qid": "Q166564", "category": "subject"},
    {"qid": "Q16970", "category": "subject"},
    {"qid": "Q17517", "category": "subject"},
    {"qid": "Q182832", "category": "subject"},
    {"qid": "Q19939", "category": "subject"},
    {"qid": "Q23397", "category": "subject"},
    {"qid": "Q23413", "category": "subject"},
    {"qid": "Q30034", "category": "subject"},
    {"qid": "Q32789", "category": "subject"},
    {"qid": "Q3314483", "category": "subject"},
    {"qid": "Q34038", "category": "subject"},
    {"qid": "Q34442", "category": "subject"},
    {"qid": "Q34493", "category": "subject"},
    {"qid": "Q40080", "category": "subject"},
    {"qid": "Q41176", "category": "subject"},
    {"qid": "Q42177", "category": "subject"},
    {"qid": "Q43193", "category": "subject"},
    {"qid": "Q49836", "category": "subject"},
    {"qid": "Q54050", "category": "subject"},
    {"qid": "Q55488", "category": "subject"},
    {"qid": "Q57216", "category": "subject"},
    {"qid": "Q643352", "category": "subject"},
    {"qid": "Q1248784", "category": "subject"},
    {"qid": "Q131514", "category": "subject"},
    {"qid": "Q134307", "category": "genre_format"},
    {"qid": "Q13430821", "category": "subject"}
  ]
}