{
  "schema_version": 1,
  "snapshot_version": 1,
  "created_at": "2026-08-23T00:00:00+00:00",
  "source": {
    "name": "Wikidata",
    "dump_uri": "file:///replace/with/pinned-wikidata-dump.json",
    "dump_sha256": "0000000000000000000000000000000000000000000000000000000000000000",
    "license_id": "CC0-1.0"
  },
  "concepts": [
    {
      "qid": "Q4421",
      "category": "subject"
    },
    {
      "qid": "Q8502",
      "category": "subject"
    }
  ]
}